{
  "format": "zryna.generic-owned-layout-v1.proposed-fixtures",
  "status": "candidate-only",
  "universe": "bool=0, i32=1, String=2, Option<String>=3, Option<Option<String>>=4, Result<Option<String>,String>=5; each case retains its complete prefix",
  "cases": [
    {
      "name": "Option<String>",
      "typeKeyHex": "14010000000100000002",
      "typeKeySha256": "5f7623f83d87a7f8946bd8e890e8b87df7e0e67ba7d26416192a9d7f4836296f",
      "typeId": 3,
      "targets": [
        {
          "target": 1,
          "size": 16,
          "alignment": 4,
          "payloadOffset": 4,
          "payloadAreaSize": 12,
          "recordHex": "4c0000000c0000000300000001000000010000001000000000000000040000000000000001000000020000000200000004000000000000000c0000000000000000000000ffffffff0100000002000000",
          "documentBytes": 230,
          "sha256": "c35a4b9cc149c581c4ecd70c7a51665ccf5d9ca61f8da755e13cde29b9527008"
        },
        {
          "target": 2,
          "size": 32,
          "alignment": 8,
          "payloadOffset": 8,
          "payloadAreaSize": 24,
          "recordHex": "4c0000000c000000030000000100000001000000200000000000000008000000000000000100000002000000020000000800000000000000180000000000000000000000ffffffff0100000002000000",
          "documentBytes": 230,
          "sha256": "e46e2cc02b5b544659bcdeec89be1c4f9c2736b2add76fa3cac7f50d92813d1f"
        }
      ]
    },
    {
      "name": "Option<Option<String>>",
      "typeKeyHex": "14010000000a00000014010000000100000002",
      "typeKeySha256": "b7ea58fe4408141714b8b3cc81ba7e2aa42732a23cf31e9864b214763a109558",
      "typeId": 4,
      "targets": [
        {
          "target": 1,
          "size": 20,
          "alignment": 4,
          "payloadOffset": 4,
          "payloadAreaSize": 16,
          "recordHex": "4c0000000c000000040000000100000001000000140000000000000004000000000000000100000003000000020000000400000000000000100000000000000000000000ffffffff0100000003000000",
          "documentBytes": 310,
          "sha256": "75d3e8a788b799b38e6bfc51f84591ef77d5580594a9242a96deb69e92990db5"
        },
        {
          "target": 2,
          "size": 40,
          "alignment": 8,
          "payloadOffset": 8,
          "payloadAreaSize": 32,
          "recordHex": "4c0000000c000000040000000100000001000000280000000000000008000000000000000100000003000000020000000800000000000000200000000000000000000000ffffffff0100000003000000",
          "documentBytes": 310,
          "sha256": "f373c445f59f38aeb3c7f24f4f13ef585f3014ae63e19d7d708815318776ca19"
        }
      ]
    },
    {
      "name": "Result<Option<String>,String>",
      "typeKeyHex": "15020000000a000000140100000001000000020100000002",
      "typeKeySha256": "af034ca6c34bccc705f17ac4edfeaa06f058b69444d843da45730b619376916d",
      "typeId": 5,
      "targets": [
        {
          "target": 1,
          "size": 20,
          "alignment": 4,
          "payloadOffset": 4,
          "payloadAreaSize": 16,
          "recordHex": "500000000d00000005000000010000000100000014000000000000000400000000000000020000000300000002000000020000000400000000000000100000000000000000000000030000000100000002000000",
          "documentBytes": 394,
          "sha256": "cde71ef42bba445e20a00ff606077b03f9bc68908e01111a3af0e72e4a8a8df7"
        },
        {
          "target": 2,
          "size": 40,
          "alignment": 8,
          "payloadOffset": 8,
          "payloadAreaSize": 32,
          "recordHex": "500000000d00000005000000010000000100000028000000000000000800000000000000020000000300000002000000020000000800000000000000200000000000000000000000030000000100000002000000",
          "documentBytes": 394,
          "sha256": "c40d3d913d7b3fac1a246f9f1591fdee71323e1728c9ad4b6444ba1d497f030b"
        }
      ]
    }
  ]
}
